{
  "schema_version": 1,
  "author_id": "kedrov",
  "updated_at": "2026-07-01",
  "source_corpus_paths": [
    "kedrov_markdown/kedrov_md/"
  ],
  "required_entry_ids": [
    "kedrov",
    "engels",
    "marx",
    "lenin",
    "hegel",
    "dialectics-of-nature",
    "capital",
    "dialectics",
    "matter",
    "motion",
    "contradiction",
    "necessity",
    "chance",
    "cognition",
    "truth",
    "labor",
    "practice",
    "science",
    "classification-of-sciences"
  ],
  "entries": [
    {
      "id": "kedrov",
      "category": "person",
      "canonical": "Бонифатий Михайлович Кедров",
      "forms": ["Bonifaty Kedrov", "B. M. Kedrov", "Кедров", "Kedrov"],
      "zh_preferred": "博尼法季·凯德洛夫",
      "zh_alternatives": ["凯德洛夫"],
      "status": "approved",
      "notes": "本集合中心作者。",
      "evidence": [{"corpus_path": "kedrov_markdown/kedrov_md/", "note": "Kedrov corpus."}]
    },
    {
      "id": "engels",
      "category": "person",
      "canonical": "Фридрих Энгельс",
      "forms": ["Engels", "Энгельс", "F. Engels"],
      "zh_preferred": "弗里德里希·恩格斯",
      "zh_alternatives": ["恩格斯"],
      "status": "approved",
      "notes": "凯德洛夫语料中尤其高频，常与自然辩证法相关。",
      "evidence": [{"corpus_path": "kedrov_markdown/kedrov_md/", "note": "高频人物名。"}]
    },
    {
      "id": "marx",
      "category": "person",
      "canonical": "Карл Маркс",
      "forms": ["Marx", "Маркс", "K. Marx"],
      "zh_preferred": "卡尔·马克思",
      "zh_alternatives": ["马克思"],
      "status": "approved",
      "notes": "马克思主义哲学和科学史语境中的关键人物。",
      "evidence": [{"corpus_path": "kedrov_markdown/kedrov_md/", "note": "高频人物名。"}]
    },
    {
      "id": "lenin",
      "category": "person",
      "canonical": "Владимир Ильич Ленин",
      "forms": ["Lenin", "Ленин", "V. I. Lenin"],
      "zh_preferred": "弗拉基米尔·伊里奇·列宁",
      "zh_alternatives": ["列宁"],
      "status": "approved",
      "notes": "辩证唯物主义和认识论语境中的关键人物。",
      "evidence": [{"corpus_path": "kedrov_markdown/kedrov_md/", "note": "高频人物名。"}]
    },
    {
      "id": "hegel",
      "category": "person",
      "canonical": "Георг Вильгельм Фридрих Гегель",
      "forms": ["Hegel", "Гегель", "G. W. F. Hegel"],
      "zh_preferred": "格奥尔格·威廉·弗里德里希·黑格尔",
      "zh_alternatives": ["黑格尔"],
      "status": "approved",
      "notes": "辩证法史语境中的关键人物。",
      "evidence": [{"corpus_path": "kedrov_markdown/kedrov_md/", "note": "重要人物名。"}]
    },
    {
      "id": "kant",
      "category": "person",
      "canonical": "Иммануил Кант",
      "forms": ["Kant", "Кант", "I. Kant"],
      "zh_preferred": "伊曼努尔·康德",
      "zh_alternatives": ["康德"],
      "status": "approved",
      "notes": "哲学史和认识论语境中的人物。",
      "evidence": [{"corpus_path": "kedrov_markdown/kedrov_md/", "note": "相关人物名。"}]
    },
    {
      "id": "feuerbach",
      "category": "person",
      "canonical": "Людвиг Фейербах",
      "forms": ["Feuerbach", "Фейербах", "L. Feuerbach"],
      "zh_preferred": "路德维希·费尔巴哈",
      "zh_alternatives": ["费尔巴哈"],
      "status": "approved",
      "notes": "马克思主义哲学史语境中的人物。",
      "evidence": [{"corpus_path": "kedrov_markdown/kedrov_md/", "note": "相关人物名。"}]
    },
    {
      "id": "dialectics-of-nature",
      "category": "work",
      "canonical": "Диалектика природы",
      "forms": ["Dialectics of Nature"],
      "zh_preferred": "《自然辩证法》",
      "zh_alternatives": [],
      "status": "approved",
      "notes": "恩格斯著作，凯德洛夫语料核心参照。",
      "evidence": [{"corpus_path": "kedrov_markdown/kedrov_md/", "note": "核心著作名。"}]
    },
    {
      "id": "capital",
      "category": "work",
      "canonical": "Капитал",
      "forms": ["Capital", "Das Kapital"],
      "zh_preferred": "《资本论》",
      "zh_alternatives": [],
      "status": "approved",
      "notes": "马克思主要著作。",
      "evidence": [{"corpus_path": "kedrov_markdown/kedrov_md/", "note": "高频著作名。"}]
    },
    {
      "id": "anti-duhring",
      "category": "work",
      "canonical": "Анти-Дюринг",
      "forms": ["Anti-Dühring", "Herrn Eugen Dührings Umwälzung der Wissenschaft"],
      "zh_preferred": "《反杜林论》",
      "zh_alternatives": [],
      "status": "approved",
      "notes": "恩格斯著作，科学分类和辩证法语境中常见。",
      "evidence": [{"corpus_path": "kedrov_markdown/kedrov_md/", "note": "相关著作名。"}]
    },
    {
      "id": "dialectics",
      "category": "concept",
      "canonical": "диалектика",
      "forms": ["dialectics", "диалектики"],
      "zh_preferred": "辩证法",
      "zh_alternatives": [],
      "status": "approved",
      "notes": "凯德洛夫语料核心概念。",
      "evidence": [{"corpus_path": "kedrov_markdown/kedrov_md/", "note": "高频概念。"}]
    },
    {
      "id": "matter",
      "category": "concept",
      "canonical": "материя",
      "forms": ["matter", "материи"],
      "zh_preferred": "物质",
      "zh_alternatives": [],
      "status": "approved",
      "notes": "辩证唯物主义核心概念。",
      "evidence": [{"corpus_path": "kedrov_markdown/kedrov_md/", "note": "高频概念。"}]
    },
    {
      "id": "motion",
      "category": "concept",
      "canonical": "движение",
      "forms": ["motion", "movement", "движения"],
      "zh_preferred": "运动",
      "zh_alternatives": [],
      "status": "approved",
      "notes": "自然辩证法和物质概念相关术语。",
      "evidence": [{"corpus_path": "kedrov_markdown/kedrov_md/", "note": "重要概念。"}]
    },
    {
      "id": "contradiction",
      "category": "concept",
      "canonical": "противоречие",
      "forms": ["contradiction", "противоречия"],
      "zh_preferred": "矛盾",
      "zh_alternatives": ["矛盾性"],
      "status": "provisional",
      "notes": "辩证法核心范畴。",
      "evidence": [{"corpus_path": "kedrov_markdown/kedrov_md/", "note": "高频概念。"}]
    },
    {
      "id": "necessity",
      "category": "concept",
      "canonical": "необходимость",
      "forms": ["necessity", "необходимости"],
      "zh_preferred": "必然性",
      "zh_alternatives": ["必然"],
      "status": "provisional",
      "notes": "与偶然性成对。",
      "evidence": [{"corpus_path": "kedrov_markdown/kedrov_md/", "note": "高频概念。"}]
    },
    {
      "id": "chance",
      "category": "concept",
      "canonical": "случайность",
      "forms": ["chance", "contingency", "случайности"],
      "zh_preferred": "偶然性",
      "zh_alternatives": ["偶然"],
      "status": "provisional",
      "notes": "与必然性成对。",
      "evidence": [{"corpus_path": "kedrov_markdown/kedrov_md/", "note": "重要概念。"}]
    },
    {
      "id": "cognition",
      "category": "concept",
      "canonical": "познание",
      "forms": ["cognition", "knowledge", "познания"],
      "zh_preferred": "认识",
      "zh_alternatives": ["认知"],
      "status": "provisional",
      "notes": "认识论和科学方法论语境中的概念。",
      "evidence": [{"corpus_path": "kedrov_markdown/kedrov_md/", "note": "高频概念。"}]
    },
    {
      "id": "truth",
      "category": "concept",
      "canonical": "истина",
      "forms": ["truth", "истины"],
      "zh_preferred": "真理",
      "zh_alternatives": ["真实"],
      "status": "provisional",
      "notes": "认识论概念。",
      "evidence": [{"corpus_path": "kedrov_markdown/kedrov_md/", "note": "高频概念。"}]
    },
    {
      "id": "labor",
      "category": "concept",
      "canonical": "труд",
      "forms": ["labor", "labour", "труда"],
      "zh_preferred": "劳动",
      "zh_alternatives": [],
      "status": "approved",
      "notes": "社会历史和实践语境中的高频概念。",
      "evidence": [{"corpus_path": "kedrov_markdown/kedrov_md/", "note": "高频概念。"}]
    },
    {
      "id": "practice",
      "category": "concept",
      "canonical": "практика",
      "forms": ["practice", "практики"],
      "zh_preferred": "实践",
      "zh_alternatives": [],
      "status": "approved",
      "notes": "认识论和马克思主义哲学语境中的概念。",
      "evidence": [{"corpus_path": "kedrov_markdown/kedrov_md/", "note": "重要概念。"}]
    },
    {
      "id": "science",
      "category": "concept",
      "canonical": "наука",
      "forms": ["science", "науки"],
      "zh_preferred": "科学",
      "zh_alternatives": [],
      "status": "approved",
      "notes": "凯德洛夫科学哲学和科学史研究核心概念。",
      "evidence": [{"corpus_path": "kedrov_markdown/kedrov_md/", "note": "高频概念。"}]
    },
    {
      "id": "classification-of-sciences",
      "category": "concept",
      "canonical": "классификация наук",
      "forms": ["classification of sciences", "классификации наук"],
      "zh_preferred": "科学分类",
      "zh_alternatives": ["科学的分类"],
      "status": "provisional",
      "notes": "凯德洛夫科学哲学中的重要主题。",
      "evidence": [{"corpus_path": "kedrov_markdown/kedrov_md/", "note": "重要概念。"}]
    },
    {
      "id": "nature",
      "category": "concept",
      "canonical": "природа",
      "forms": ["nature", "природы"],
      "zh_preferred": "自然",
      "zh_alternatives": ["自然界"],
      "status": "provisional",
      "notes": "自然辩证法语境中的概念。",
      "evidence": [{"corpus_path": "kedrov_markdown/kedrov_md/", "note": "高频概念。"}]
    },
    {
      "id": "logic",
      "category": "concept",
      "canonical": "логика",
      "forms": ["logic", "логики"],
      "zh_preferred": "逻辑",
      "zh_alternatives": [],
      "status": "approved",
      "notes": "辩证法、科学方法和认识论语境中出现。",
      "evidence": [{"corpus_path": "kedrov_markdown/kedrov_md/", "note": "高频概念。"}]
    },
    {
      "id": "voprosy-filosofii",
      "category": "journal",
      "canonical": "Вопросы философии",
      "forms": ["Problems of Philosophy", "Voprosy Filosofii"],
      "zh_preferred": "《哲学问题》",
      "zh_alternatives": [],
      "status": "approved",
      "notes": "苏联/俄罗斯哲学期刊。",
      "evidence": [{"corpus_path": "kedrov_markdown/kedrov_md/", "note": "期刊名。"}]
    }
  ]
}
